{
  "schema_version": "1.0",
  "template_id": "python.bounded-tail-call",
  "template_version": "1.0.0",
  "backend": "python",
  "backend_version": "1.0",
  "evaluator_version": "1.3.0.dev12",
  "runtime_model": "jev-1.13.0",
  "recipe_versions": {"python.A": "1.0", "python.B": "1.0", "python.C": "1.0", "python.D": "1.0", "python.E": "1.0", "python.F": "1.0", "python.G": "1.0", "python.H": "1.0", "python.I": "1.0", "python.J": "1.0", "python.K": "1.0", "python.L": "1.0", "python.M": "1.0"},
  "language": "python",
  "source_grammar": "module-tail-call-v1",
  "host_interfaces": ["reviewed top-level synchronous function", "explicit static registry", "existing host policy and runtime owner"],
  "entrypoint_profile": "reviewed existing host entry point",
  "supported_targets": {"os": ["linux", "windows-local-ntfs"], "python": ">=3.10", "deployment": ["private reviewed source bundle"], "qualification": "catalog materialization only; installed host delivery pending separate validation"},
  "dependency_format": "reviewed requirements.lock when host lifecycle is selected; otherwise declared evaluator dependency",
  "configuration_format": "reviewed JSON with jev_runtime.mode=off when host lifecycle is selected",
  "secret_references": "env:NAME references only; no secret values",
  "runtime_ownership": "existing host-owned runtime and task identity; generated feature flag off",
  "legal_decisions": "source-reviewed finite registry and Choice labels in implementation specification",
  "fallback": "source-reviewed baseline or block from implementation specification",
  "evidence_schema": "implementation-observation",
  "verification_schedule": "implementation-spec.verification, independently reviewed and not executed by materialization",
  "lifecycle": {
    "selection": "requires_current_review",
    "parameter_validation": "supported",
    "generation": "supported",
    "materialization": "supported",
    "binding_adaptation": "requires_existing_planner",
    "planning": "requires_existing_planner",
    "baseline": "pending_separate_execution_authority",
    "apply": "pending_separate_approval",
    "build": "unsupported_by_renderer",
    "install": "unsupported_by_renderer",
    "configure": "unsupported_by_renderer",
    "launch": "unsupported_by_renderer",
    "entrypoint_reachability": "pending_host_test",
    "connectivity": "pending_separate_authority",
    "verification": "pending_authorized_host_test",
    "status": "render_status_only",
    "disable": "host_control_required",
    "stop": "host_control_required",
    "upgrade": "fresh_request_required",
    "rollback": "target_rollback_requires_existing_lifecycle",
    "authorized_mode": "off",
    "shadow_mode": "pending_separate_authority",
    "canary_mode": "pending_separate_authority",
    "active_mode": "pending_separate_authority",
    "measured_benefit": "unknown"
  },
  "parameter_schema": "template-request-v1",
  "planner": "implement-plan",
  "renderer": "template-renderer-v1"
}
